{
  "rackVersion": "2.6.6",
  "rackEdition": "Pro",
  "instanceId": "1757e9b9-fead-40c2-ba94-7c343b72e2ce",
  "sessionId": "30d0c117-c861-47c3-b16c-80982704929c",
  "patchEpoch": 1,
  "patchName": null,
  "saved": true,
  "sampleRate": 44100,
  "modules": [
    {
      "moduleId": "1",
      "pluginSlug": "RackMCP",
      "pluginVersion": "2.0.0",
      "modelSlug": "Bridge",
      "modelName": "RackMCP-Bridge",
      "bypassed": false,
      "isBridge": true,
      "isProbe": false,
      "gridPosition": {
        "x": 0,
        "y": 0
      },
      "gridWidth": 8,
      "params": [
        {
          "paramId": 0,
          "name": "Reset pairing secret",
          "value": 0,
          "minValue": 0,
          "maxValue": 1,
          "defaultValue": 0,
          "normalizedValue": 0,
          "displayValue": "",
          "unit": "",
          "snapped": true
        }
      ],
      "inputs": [],
      "outputs": [],
      "expanders": {
        "left": null,
        "right": "6558968886662395"
      }
    },
    {
      "moduleId": "6558968886662395",
      "pluginSlug": "Fundamental",
      "pluginVersion": "2.6.4",
      "modelSlug": "VCO",
      "modelName": "VCO",
      "bypassed": false,
      "isBridge": false,
      "isProbe": false,
      "gridPosition": {
        "x": 8,
        "y": 0
      },
      "gridWidth": 9,
      "params": [
        {
          "paramId": 0,
          "name": "",
          "value": 0,
          "minValue": 0,
          "maxValue": 1,
          "defaultValue": 0,
          "normalizedValue": 0,
          "displayValue": "0",
          "unit": "",
          "snapped": false
        },
        {
          "paramId": 1,
          "name": "Sync mode",
          "value": 1,
          "minValue": 0,
          "maxValue": 1,
          "defaultValue": 1,
          "normalizedValue": 1,
          "displayValue": "Hard",
          "unit": "",
          "snapped": true
        },
        {
          "paramId": 2,
          "name": "Frequency",
          "value": 0,
          "minValue": -54,
          "maxValue": 54,
          "defaultValue": 0,
          "normalizedValue": 0.5,
          "displayValue": "261.63",
          "unit": " Hz",
          "snapped": false
        },
        {
          "paramId": 3,
          "name": "",
          "value": 0,
          "minValue": 0,
          "maxValue": 1,
          "defaultValue": 0,
          "normalizedValue": 0,
          "displayValue": "0",
          "unit": "",
          "snapped": false
        },
        {
          "paramId": 4,
          "name": "Frequency modulation",
          "value": 0,
          "minValue": -1,
          "maxValue": 1,
          "defaultValue": 0,
          "normalizedValue": 0.5,
          "displayValue": "0",
          "unit": "%",
          "snapped": false
        },
        {
          "paramId": 5,
          "name": "Pulse width",
          "value": 0.5,
          "minValue": 0.009999999776482582,
          "maxValue": 0.9900000095367432,
          "defaultValue": 0.5,
          "normalizedValue": 0.5,
          "displayValue": "50",
          "unit": "%",
          "snapped": false
        },
        {
          "paramId": 6,
          "name": "Pulse width modulation",
          "value": 0,
          "minValue": -1,
          "maxValue": 1,
          "defaultValue": 0,
          "normalizedValue": 0.5,
          "displayValue": "0",
          "unit": "%",
          "snapped": false
        },
        {
          "paramId": 7,
          "name": "FM mode",
          "value": 0,
          "minValue": 0,
          "maxValue": 1,
          "defaultValue": 0,
          "normalizedValue": 0,
          "displayValue": "1V/octave",
          "unit": "",
          "snapped": true
        }
      ],
      "inputs": [
        {
          "portId": 0,
          "type": "input",
          "name": "1V/octave pitch",
          "channels": 0,
          "connected": false
        },
        {
          "portId": 1,
          "type": "input",
          "name": "Frequency modulation",
          "channels": 0,
          "connected": false
        },
        {
          "portId": 2,
          "type": "input",
          "name": "Sync",
          "channels": 0,
          "connected": false
        },
        {
          "portId": 3,
          "type": "input",
          "name": "Pulse width modulation",
          "channels": 0,
          "connected": false
        }
      ],
      "outputs": [
        {
          "portId": 0,
          "type": "output",
          "name": "Sine",
          "channels": 1,
          "connected": true
        },
        {
          "portId": 1,
          "type": "output",
          "name": "Triangle",
          "channels": 0,
          "connected": false
        },
        {
          "portId": 2,
          "type": "output",
          "name": "Sawtooth",
          "channels": 0,
          "connected": false
        },
        {
          "portId": 3,
          "type": "output",
          "name": "Square",
          "channels": 0,
          "connected": false
        }
      ],
      "expanders": {
        "left": "1",
        "right": "8797253495131838"
      }
    },
    {
      "moduleId": "8797253495131838",
      "pluginSlug": "RackMCP",
      "pluginVersion": "2.0.0",
      "modelSlug": "Probe",
      "modelName": "RackMCP-Probe",
      "bypassed": false,
      "isBridge": false,
      "isProbe": true,
      "gridPosition": {
        "x": 17,
        "y": 0
      },
      "gridWidth": 8,
      "params": [],
      "inputs": [
        {
          "portId": 0,
          "type": "input",
          "name": "Probe 1",
          "channels": 1,
          "connected": true
        },
        {
          "portId": 1,
          "type": "input",
          "name": "Probe 2",
          "channels": 0,
          "connected": false
        },
        {
          "portId": 2,
          "type": "input",
          "name": "Probe 3",
          "channels": 0,
          "connected": false
        },
        {
          "portId": 3,
          "type": "input",
          "name": "Probe 4",
          "channels": 0,
          "connected": false
        },
        {
          "portId": 4,
          "type": "input",
          "name": "Probe 5",
          "channels": 0,
          "connected": false
        },
        {
          "portId": 5,
          "type": "input",
          "name": "Probe 6",
          "channels": 0,
          "connected": false
        },
        {
          "portId": 6,
          "type": "input",
          "name": "Probe 7",
          "channels": 0,
          "connected": false
        },
        {
          "portId": 7,
          "type": "input",
          "name": "Probe 8",
          "channels": 0,
          "connected": false
        }
      ],
      "outputs": [],
      "expanders": {
        "left": "6558968886662395",
        "right": null
      }
    }
  ],
  "cables": [
    {
      "cableId": "3020128356454998",
      "outputModuleId": "6558968886662395",
      "outputId": 0,
      "inputModuleId": "8797253495131838",
      "inputId": 0,
      "color": "#c8542a"
    }
  ],
  "bridgeModuleCount": 1,
  "probeModuleCount": 1,
  "fingerprint": "3f7656bd73598aeed9e4016626f62439825c2aa284327a276809defcb4989850",
  "warnings": []
}
